<?xml version="1.0" encoding="UTF-8"?>
<xs:schema xmlns:xs="http://www.w3.org/2001/XMLSchema" targetNamespace="http://www.uniovi.es" xmlns="http://www.uniovi.es" elementFormDefault="qualified">
	<xs:element name="circuito">
		<xs:complexType>
			<xs:sequence>
				<xs:element ref="nombre" />
				<xs:element ref="longitud" />
				<xs:element ref="anchura" />
				<xs:element ref="fecha" />
				<xs:element ref="hora" />
				<xs:element ref="vueltas" />
				<xs:element ref="localidad" />
				<xs:element ref="pais" />
				<xs:element ref="referencias" />
				<xs:element ref="galeria" />
				<xs:element ref="coordenadas" />
				<xs:element ref="puntos" />
			</xs:sequence>
		</xs:complexType>
	</xs:element>
	<xs:element name="nombre" type="xs:string" />
	<xs:element name="longitud">
		<xs:complexType>
			<xs:simpleContent>
				<xs:extension base="xs:float">
					<xs:attribute name="unidades_longitud" type="xs:string" use="required" />
				</xs:extension>
			</xs:simpleContent>
		</xs:complexType>
	</xs:element>
	<xs:element name="anchura">
		<xs:complexType>
			<xs:simpleContent>
				<xs:extension base="xs:positiveInteger">
					<xs:attribute name="unidades_anchura" type="xs:string" use="required" />
				</xs:extension>
			</xs:simpleContent>
		</xs:complexType>
	</xs:element>
	<xs:element name="fecha" type="xs:date" />
	<xs:element name="hora" type="xs:time" />
	<xs:element name="vueltas" type="xs:positiveInteger" />
	<xs:element name="localidad" type="xs:string" />
	<xs:element name="pais" type="xs:string" />
	<xs:element name="referencias">
		<xs:complexType>
			<xs:sequence>
				<xs:element ref="referencia" minOccurs="3" maxOccurs="unbounded" />
			</xs:sequence>
		</xs:complexType>
	</xs:element>
	<xs:element name="referencia" type="xs:string" />
	<xs:element name="galeria">
		<xs:complexType>
			<xs:sequence>
				<xs:element ref="fotos" />
				<xs:element ref="videos" />
			</xs:sequence>
		</xs:complexType>
	</xs:element>
	<xs:element name="fotos">
		<xs:complexType>
			<xs:sequence>
				<xs:element minOccurs="1" maxOccurs="5" ref="foto" />
			</xs:sequence>
		</xs:complexType>
	</xs:element>
	<xs:element name="foto" type="xs:string" />
	<xs:element name="videos">
		<xs:complexType>
			<xs:sequence>
				<xs:element minOccurs="0" maxOccurs="3" ref="video" />
			</xs:sequence>
		</xs:complexType>
	</xs:element>
	<xs:element name="video" type="xs:string" />
	<xs:element name="coordenadas">
		<xs:complexType>
			<xs:sequence>
				<xs:element ref="coordenada" minOccurs="3" maxOccurs="3"/>
			</xs:sequence>
			<xs:attribute name="pertenencia" type="xs:string" use="required" />
		</xs:complexType>
	</xs:element>
	<xs:element name="coordenada">
		<xs:complexType>
			<xs:simpleContent>
				<xs:extension base="xs:string">
					<xs:attribute name="tipo" type="tipoCoordenada" use="required" />
					<xs:attribute name="unidad" type="unidadCoordenada" use="required" />
				</xs:extension>
			</xs:simpleContent>
		</xs:complexType>
	</xs:element>
	<xs:simpleType name="tipoCoordenada">
		<xs:restriction base="xs:string">
			<xs:enumeration value="Longitud" />
			<xs:enumeration value="Latitud" />
			<xs:enumeration value="Altitud" />
		</xs:restriction>
	</xs:simpleType>
	<xs:simpleType name="unidadCoordenada">
		<xs:restriction base="xs:string">
			<xs:enumeration value="metros" />
			<xs:enumeration value="grados" />
		</xs:restriction>
	</xs:simpleType>
	<xs:element name="puntos">
		<xs:complexType>
			<xs:sequence>
				<xs:element minOccurs="1" maxOccurs="unbounded" ref="tramo" />
			</xs:sequence>
		</xs:complexType>
	</xs:element>
	<xs:element name="tramo">
		<xs:complexType>
			<xs:sequence>
				<xs:element ref="distancia" />
				<xs:element ref="coordenadas" />
				<xs:element ref="sector" />
			</xs:sequence>
			<xs:attribute name="numero_tramo" type="xs:positiveInteger" use="required" />
		</xs:complexType>
	</xs:element>
	<xs:element name="distancia">
		<xs:complexType>
			<xs:simpleContent>
				<xs:extension base="xs:float">
					<xs:attribute name="unidades_distancia" type="xs:string" use="required" />
				</xs:extension>
			</xs:simpleContent>
		</xs:complexType>
	</xs:element>
	<xs:element name="sector">
		<xs:complexType>
			<xs:attribute name="numero_sector" type="xs:positiveInteger" use="required" />
		</xs:complexType>
	</xs:element>
</xs:schema>